stories_id,publish_date,title,url,language,ap_syndicated,themes,media_id,media_name,media_url
"50414723","2025-09-27 12:05:45","Politique- Une nouvelle marche de l’opposition ivoirienne projetée pour le 4 octobre prochain","https://www.laurore.net/politique-une-nouvelle-marche-de-lopposition-ivoirienne-projetee-pour-le-4-octobre-prochain/?utm_source=rss&utm_medium=rss&utm_campaign=politique-une-nouvelle-marche-de-lopposition-ivoirienne-projetee-pour-le-4-octobre-prochain","fr","False","","16116","Laurore - L’information vérifiée","https://www.laurore.net/"
"50414718","2025-09-29 06:54:03","Election présidentielle : l’OIDH organise un forum sur l’intégrité de l’information","https://www.laurore.net/election-presidentielle-loidh-organise-un-forum-sur-lintegrite-de-linformation/?utm_source=rss&utm_medium=rss&utm_campaign=election-presidentielle-loidh-organise-un-forum-sur-lintegrite-de-linformation","fr","False","","16116","Laurore - L’information vérifiée","https://www.laurore.net/"
"50417897","2025-09-30 00:41:28","L’Intelligent en PDF:  Des réactions affluent depuis hier   HISTORIQUE : L’Intelligent d’Abidjan 1er QIG ivoirien certifié avec la norme CWA 17493","https://www.lintelligentdabidjan.info/news/lintelligent-en-pdf-des-reactions-affluent-depuis-hier-historique-lintelligent-dabidjan-1er-qig-ivoirien-certifie-avec-la-norme-cwa-17493/?utm_source=rss&utm_medium=rss&utm_campaign=lintelligent-en-pdf-des-reactions-affluent-depuis-hier-historique-lintelligent-dabidjan-1er-qig-ivoirien-certifie-avec-la-norme-cwa-17493","fr","False","","10058","L'Intelligent d'Abidjan | Le quotidien independant dont vous avez rêvé","https://www.lintelligentdabidjan.info/news/"
"50419998","2025-09-30 02:28:29","Côte d’Ivoire-AIP / Présidentielle 2025 : les populations de la région du N’Zi invitées à être des ambassadeurs de paix","https://www.aip.ci/256262/cote-divoire-aip-presidentielle-2025-les-populations-de-la-region-du-nzi-invitees-a-etre-des-ambassadeurs-de-paix/?utm_source=rss&utm_medium=rss&utm_campaign=cote-divoire-aip-presidentielle-2025-les-populations-de-la-region-du-nzi-invitees-a-etre-des-ambassadeurs-de-paix","fr","False","","14899","AIP (Agence Ivoirienne de Presse de Côte d'Ivoire)","https://www.aip.ci"
"50419996","2025-09-30 03:27:14","Côte d’Ivoire-AIP/Revue de presse/La présidentielle 2025 principale affiche des journaux de ce mardi 30 septembre","https://www.aip.ci/256279/cote-divoire-aip-revue-de-presse-la-presidentielle-2025-principale-affiche-des-journaux-de-ce-mardi-30-septembre/?utm_source=rss&utm_medium=rss&utm_campaign=cote-divoire-aip-revue-de-presse-la-presidentielle-2025-principale-affiche-des-journaux-de-ce-mardi-30-septembre","fr","False","","14899","AIP (Agence Ivoirienne de Presse de Côte d'Ivoire)","https://www.aip.ci"
"50419995","2025-09-30 03:42:52","Côte d’Ivoire-AIP/ Présidentielle 2025 : un responsable du PDCI à Gagnoa vire au RHDP","https://www.aip.ci/256268/cote-divoire-aip-presidentielle-2025-un-responsable-du-pdci-a-gagnoa-vire-au-rhdp/?utm_source=rss&utm_medium=rss&utm_campaign=cote-divoire-aip-presidentielle-2025-un-responsable-du-pdci-a-gagnoa-vire-au-rhdp","fr","False","","14899","AIP (Agence Ivoirienne de Presse de Côte d'Ivoire)","https://www.aip.ci"
"50427974","2025-09-30 04:27:43","Côte d’Ivoire / Ppa-Ci – Pdci-Rda : Le Front commun annonce une marche le 4 octobre prochain","https://canalivoire.net/cote-divoire-ppa-ci-pdci-rda-le-front-commun-annonce-une-marche-le-4-octobre-prochain/","fr","False","","16841","Canal Ivoire","https://canalivoire.net/"
"50428290","2025-09-30 08:58:42","Jean-Louis Billon « la Côte d’Ivoire doit vivre une transition démocratique »","https://abidjantv.net/actualites/jean-louis-billon-la-cote-divoire-doit-vivre-une-transition-democratique/?utm_source=rss&utm_medium=rss&utm_campaign=jean-louis-billon-la-cote-divoire-doit-vivre-une-transition-democratique","fr","False","","10024","AbidjanTV.net","http://abidjantv.net/"
"50428957","2025-09-30 09:48:40","Côte d’Ivoire-AIP/ Présidentielle 2025: le RHDP forme ses responsables sur une campagne électorale victorieuse","https://www.aip.ci/256492/cote-divoire-aip-presidentielle-2025-le-rhdp-forme-ses-responsables-sur-une-campagne-electorale-victorieuse/?utm_source=rss&utm_medium=rss&utm_campaign=cote-divoire-aip-presidentielle-2025-le-rhdp-forme-ses-responsables-sur-une-campagne-electorale-victorieuse","fr","False","","14899","AIP (Agence Ivoirienne de Presse de Côte d'Ivoire)","https://www.aip.ci"
"50429339","2025-09-30 08:05:17","Affaire « des cadres du PPA-CI devant le procureur »: Damana Pickass révèle les raisons de la convocation","https://www.lemandatexpress.net/2025/09/30/affaire-des-cadres-du-ppa-ci-devant-le-procureur-damana-pickass-revele-les-raisons-de-la-convocation/","fr","False","","16151","VidoRev - Video WordPress Theme","https://www.lemandatexpress.net/"
"50430152","2025-09-30 10:47:13","Présidentielle 2025 / Ahoua Don Mello prévient : « Nous ne combattons pas seulement le quatrième mandat. »","https://www.lemandatexpress.net/2025/09/30/presidentielle-2025-ahoua-don-mello-previent-nous-ne-combattons-pas-seulement-le-quatrieme-mandat/","fr","False","","16151","VidoRev - Video WordPress Theme","https://www.lemandatexpress.net/"
"50431910","2025-09-25 14:23:21","Visite de l’émissaire de l’ONU en Côte d’Ivoire  / Le RHDP dévoile le contenu de la rencontre entre Leonardo Santos Simao et le Président Ouattara","https://unite.ci/visite-de-lemissaire-de-lonu-en-cote-divoire-le-rhdp-devoile-le-contenu-de-la-rencontre-entre-leonardo-santos-simao-et-le-president-ouattara/","fr","False","","16852","Unite","https://unite.ci/"
"50432203","2025-09-30 11:41:53","Présidentielle 2025:  Kafana invite les animateurs de la campagne RHDP au respect des adversaires politiques","https://www.lemandatexpress.net/2025/09/30/presidentielle-2025-kafana-invite-les-animateurs-de-la-campagne-rhdp-au-respect-des-adversaires-politiques/","fr","False","","16151","VidoRev - Video WordPress Theme","https://www.lemandatexpress.net/"
"50434182","2025-09-30 13:28:28","Côte d’Ivoire : Les responsables du PPA-CI interpellent des policiers filmant leur siège, le parti dénonce un harcèlement","https://www.lemandatexpress.net/2025/09/30/cote-divoire-les-responsables-du-ppa-ci-interpellent-des-policiers-filmant-leur-siege-le-parti-denonce-un-harcelement/","fr","False","","16151","VidoRev - Video WordPress Theme","https://www.lemandatexpress.net/"
"50438363","2025-09-30 16:37:36","Côte d’Ivoire-AIP/ Présidentielle 2025: un mouvement politique mobilise pour Ahoua Don Mello","https://www.aip.ci/256667/cote-divoire-aip-presidentielle-2025-un-mouvement-politique-mobilise-pour-ahoua-don-mello/?utm_source=rss&utm_medium=rss&utm_campaign=cote-divoire-aip-presidentielle-2025-un-mouvement-politique-mobilise-pour-ahoua-don-mello","fr","False","","14899","AIP (Agence Ivoirienne de Presse de Côte d'Ivoire)","https://www.aip.ci"
"50439271","2025-09-30 14:48:46","Côte d’Ivoire : Élections 2025 à forts enjeux pour la démocratie et la stabilité","https://kibanyiguinee.info/2025/09/30/cote-divoire-elections-2025-a-forts-enjeux-pour-la-democratie-et-la-stabilite/","fr","False","","16432","Kibanyi Guinée","https://kibanyiguinee.info/"
"50440812","2025-09-30 18:28:37","Lutte contre la désinformation : l’Oidh initie un forum de formation des populations à Abidjan","https://nouvellesducontinent.com/lutte-contre-la-desinformation-loidh-initie-un-forum-de-formation-des-populations-a-abidjan/","fr","False","","16109","Nouvelles Du Continent – Au coeur de l'actualité d'ici et d'ailleurs 24/24h","https://nouvellesducontinent.com/"
"50442406","2025-09-30 23:13:15","Côte d'Ivoire: deux cadres du parti de Laurent Gbagbo inculpés pour troubles à l'ordre public","https://www.rfi.fr/fr/afrique/20251001-c%C3%B4te-d-ivoire-deux-cadres-du-parti-de-laurent-gbagbo-inculp%C3%A9s-pour-troubles-%C3%A0-l-ordre-public","fr","False","","14598","Écouter RFI Afrique en direct - RFI","https://www.rfi.fr/fr/direct-afrique"
"50443518","2025-09-30 17:24:36","Présidentielle 2025/Ahoua Don Melo recevant Blé Goudé: « Cela participe de l’esprit d’équipe et de gauche en Côte d’Ivoire »","https://liferadio.ci/presidentielle-2025-ahoua-don-melo-recoit-ble-goude-cela-participe-de-lesprit-dequipe-et-de-lesprit-de-gauche-en-cote-divoire/","fr","False","","16108","Accueil | Life Radio","https://liferadio.ci/"
"50446817","2025-10-01 03:45:19","Côte d’Ivoire-AIP /Revue de presse/La présidentielle de 2025 et l’arrestation de membres du PPA-CI à la Une des journaux","https://www.aip.ci/256863/cote-divoire-aip-revue-de-presse-la-presidentielle-de-2025-et-larrestation-de-membres-du-ppa-ci-a-la-une-des-journaux/?utm_source=rss&utm_medium=rss&utm_campaign=cote-divoire-aip-revue-de-presse-la-presidentielle-de-2025-et-larrestation-de-membres-du-ppa-ci-a-la-une-des-journaux","fr","False","","14899","AIP (Agence Ivoirienne de Presse de Côte d'Ivoire)","https://www.aip.ci"
"50448646","2025-10-01 04:14:12","Présidentielle 2025 : Ahoua Don Mello échange avec Charles Blé Goudé sur sa vision de rupture démocratique et économique","https://www.lemandatexpress.net/2025/10/01/presidentielle-2025-ahoua-don-mello-echange-avec-charles-ble-goude-sur-sa-vision-de-rupture-democratique-et-economique/","fr","False","","16151","VidoRev - Video WordPress Theme","https://www.lemandatexpress.net/"
"50455428","2025-10-01 08:24:19","Côte d’Ivoire-AIP/ Présidentielle 2025: voter, un droit et un devoir citoyen","https://www.aip.ci/256993/cote-divoire-aip-presidentielle-2025-voter-un-droit-et-un-devoir-citoyen/?utm_source=rss&utm_medium=rss&utm_campaign=cote-divoire-aip-presidentielle-2025-voter-un-droit-et-un-devoir-citoyen","fr","False","","14899","AIP (Agence Ivoirienne de Presse de Côte d'Ivoire)","https://www.aip.ci"
"50456424","2025-10-01 08:42:58","Côte d’Ivoire-AIP/ Présidentielle 2025: les communautés ethniques s’engagent pour la paix et la cohésion sociale à Sinfra","https://www.aip.ci/256861/cote-divoire-aip-presidentielle-2025-les-communautes-ethniques-sengagent-pour-la-paix-et-la-cohesion-sociale-a-sinfra/?utm_source=rss&utm_medium=rss&utm_campaign=cote-divoire-aip-presidentielle-2025-les-communautes-ethniques-sengagent-pour-la-paix-et-la-cohesion-sociale-a-sinfra","fr","False","","14899","AIP (Agence Ivoirienne de Presse de Côte d'Ivoire)","https://www.aip.ci"
"50459077","2025-10-01 07:07:06","Quels sont les 10 pays les plus sûrs d'Afrique en 2025 ?","https://www.bbc.com/afrique/articles/c8jm01jp29go?at_medium=RSS&at_campaign=rss","fr","False","","12279","BBC News Afrique","https://www.bbc.com/afrique"
"50463107","2025-10-01 12:29:00","2e session parlementaire: PDCI,  PPA-CI et des députés non-inscrits dont Assalé Tiemoko, boycottent l’ouverture","https://www.linfodrome.com/politique/114030-2e-session-parlementaire-pdci-ppa-ci-et-des-deputes-non-inscrits-dont-assale-tiemoko-boycottent-l-ouverture","fr","False","","10047","L'actualité ivoirienne indépendante de Côte d'Ivoire | Linfodrome","https://www.linfodrome.com/"
"50464497","2025-09-29 04:01:44","Présidentielle 2025/ Candidature d’Alassane Ouattara : Ahoussou Jeannot sollicite le soutien des rois et chefs traditionnels","https://www.laurore.net/presidentielle-2025-candidature-dalassane-ouattara-ahoussou-jeannot-sollicite-le-soutien-des-rois-et-chefs-traditionnels/?utm_source=rss&utm_medium=rss&utm_campaign=presidentielle-2025-candidature-dalassane-ouattara-ahoussou-jeannot-sollicite-le-soutien-des-rois-et-chefs-traditionnels","fr","False","","16116","Laurore - L’information vérifiée","https://www.laurore.net/"
"50464553","2025-10-01 11:19:25","Me David Béavogui au président Alassane Ouattara : « ne vous présentez pas à la future élection présidentielle »","https://mediaguinee.com/2025/10/me-david-beavogui-au-president-alassane-ouattara-ne-vous-presentez-pas-a-la-future-election-presidentielle/","fr","False","","9642","Mediaguinee.org - La Guinée au quotidien","http://mediaguinee.org/"
"50464659","2025-10-01 11:19:25","Me David Béavogui au président Alassane Ouattara : « ne vous présentez pas à la future élection présidentielle »","https://mediaguinee.com/2025/10/me-david-beavogui-au-president-alassane-ouattara-ne-vous-presentez-pas-a-la-future-election-presidentielle/","fr","False","","16099","Mediaguinee.com - Actualité de la Guinée au quotidien","http://mediaguinee.com/"
"50465698","2025-10-01 13:54:25","4è mandat Ouattara, opacité de parrainage, droits de l’homme, arrestations arbitraires…Les députés Ppa-CI, Pdci-Rda et les autres suspendent leur participation parlementaire","https://credochristi.com/a-la-une/4e-mandat-ouattara-opacite-de-parrainage-droits-de-lhomme-arrestations-arbitrairesles-deputes-ppa-ci-pdci-rda-et-les-autres-suspendent-leur-participation-parlementaire/","fr","False","","16842","Credo Christi","https://credochristi.com/"
"50465914","2025-10-01 13:45:12","Marche annoncée du Front commun : la réaction du porte-parole du gouvernement","https://abidjantv.net/politique/marche-annoncee-du-front-commun-la-reaction-du-porte-parole-du-gouvernement/?utm_source=rss&utm_medium=rss&utm_campaign=marche-annoncee-du-front-commun-la-reaction-du-porte-parole-du-gouvernement","fr","False","","10024","AbidjanTV.net","http://abidjantv.net/"
"50465913","2025-10-01 13:56:37","2e session parlementaire: PDCI, PPA-CI et des députés non-inscrits dont Assalé Tiemoko, boycottent l’ouverture","https://abidjantv.net/politique/2e-session-parlementaire-pdci-ppa-ci-et-des-deputes-non-inscrits-dont-assale-tiemoko-boycottent-louverture/?utm_source=rss&utm_medium=rss&utm_campaign=2e-session-parlementaire-pdci-ppa-ci-et-des-deputes-non-inscrits-dont-assale-tiemoko-boycottent-louverture","fr","False","","10024","AbidjanTV.net","http://abidjantv.net/"
"50466652","2025-10-01 15:10:35","2e session ordinaire 2025 de l’Assemblée Nationale: Voici l’intégralité du discours de Bictogo","https://www.lemandatexpress.net/2025/10/01/2e-session-ordinaire-2025-de-lassemblee-nationale-voici-lintegralite-du-discours-de-bictogo/","fr","False","","16151","VidoRev - Video WordPress Theme","https://www.lemandatexpress.net/"
"50467120","2025-10-01 15:19:06","Côte d’Ivoire-AIP/ Les députés de l’opposition boycottent la rentrée parlementaire et dénoncent un processus électoral « calamiteux »","https://www.aip.ci/257288/cote-divoire-aip-les-deputes-de-lopposition-boycottent-la-rentree-parlementaire-et-denoncent-un-processus-electoral-calamiteux/?utm_source=rss&utm_medium=rss&utm_campaign=cote-divoire-aip-les-deputes-de-lopposition-boycottent-la-rentree-parlementaire-et-denoncent-un-processus-electoral-calamiteux","fr","False","","14899","AIP (Agence Ivoirienne de Presse de Côte d'Ivoire)","https://www.aip.ci"
"50467787","2025-10-01 15:58:02","Côte d’Ivoire-AIP/ Adama Bictogo appelle les députés à être des “soldats de la paix” pour des élections apaisées","https://www.aip.ci/257311/cote-divoire-aip-adama-bictogo-appelle-les-deputes-a-etre-des-soldats-de-la-paix-pour-des-elections-apaisees/?utm_source=rss&utm_medium=rss&utm_campaign=cote-divoire-aip-adama-bictogo-appelle-les-deputes-a-etre-des-soldats-de-la-paix-pour-des-elections-apaisees","fr","False","","14899","AIP (Agence Ivoirienne de Presse de Côte d'Ivoire)","https://www.aip.ci"
"50467866","2025-10-01 15:57:47","Assemblée nationale : Les députés de l’opposition boycottent l&#8217;ouverture de la 2e session parlementaire","https://abidjantv.net/politique/assemblee-nationale-les-deputes-de-lopposition-boycottent-louverture-de-la-2e-session-parlementaire/?utm_source=rss&utm_medium=rss&utm_campaign=assemblee-nationale-les-deputes-de-lopposition-boycottent-louverture-de-la-2e-session-parlementaire","fr","False","","10024","AbidjanTV.net","http://abidjantv.net/"
"50470236","2025-10-01 07:33:13","Football: Zoro Marc André officialise sa candidature à la présidence de la FIF","https://connectionivoirienne.net/2025/10/01/football-zoro-marc-andre-officialise-sa-candidature-a-la-presidence-de-la-fif/","fr","False","","10030","Le retour de Gbagbo « un sujet de crispation » (de la nécessité de désarmer les paroles) en Côte-d’Ivoire - Connectionivoirienne","https://www.connectionivoirienne.net/"
"50470538","2025-10-01 18:20:43","Côte d’Ivoire-AIP/ Élection présidentielle 2025: Myss Belmonde Dogo sensibilise sur les violences électorales à Sinfra","https://www.aip.ci/256908/cote-divoire-aip-election-presidentielle-2025-myss-belmonde-dogo-sensibilise-sur-les-violences-electorales-a-sinfra/?utm_source=rss&utm_medium=rss&utm_campaign=cote-divoire-aip-election-presidentielle-2025-myss-belmonde-dogo-sensibilise-sur-les-violences-electorales-a-sinfra","fr","False","","14899","AIP (Agence Ivoirienne de Presse de Côte d'Ivoire)","https://www.aip.ci"
"50471090","2025-10-01 18:55:55","Communiqué du conseil des ministres du 1er octobre 2025","https://www.lemandatexpress.net/2025/10/01/communique-du-conseil-des-ministres-du-1er-octobre-2025/","fr","False","","16151","VidoRev - Video WordPress Theme","https://www.lemandatexpress.net/"
"50471354","2025-10-01 15:31:54","CÔTE D’IVOIRE : PPA-CI/  LES RAISONS DE LA MISE AUX ARRETS DE  BLAISE LASME ET DAHI NESTOR","https://unite.ci/cote-divoire-ppa-ci-les-raisons-de-la-mise-aux-arrets-de-blaise-lasme-et-dahi-nestor/","fr","False","","16852","Unite","https://unite.ci/"
"50472048","2025-10-01 08:43:31","Côte d’Ivoire / PDCI-RDA / Une conférence-débat dresse un réquisitoire contre la gouvernance Ouattara","https://nasopresse.com/2025/10/01/cote-divoire-pdci-rda-une-conference-debat-dresse-un-requisitoire-contre-la-gouvernance-ouattara/","fr","False","","16851","Naso Presse","https://nasopresse.com/"
"50472118","2025-09-29 05:01:04","Côte d’Ivoire : La HACA dévoile huit mesures pour encadrer la couverture médiatique de la présidentielle 2025","https://mediadiversity.info/2025/09/29/cote-divoire-la-haca-devoile-huit-mesures-pour-encadrer-la-couverture-mediatique-de-la-presidentielle-2025/","fr","False","","16849","Media Diversity","https://mediadiversity.info/"
"50472369","2025-10-01 10:59:57","L’ancienne mentalité politique est incompatible avec la révolution","https://tamtaminfo.com/lancienne-mentalite-politique-est-incompatible-avec-la-revolution/","fr","False","","5051","TamTam Info","http://www.tamtaminfo.com/"
"50473162","2025-10-01 18:43:55","Présidentielle d’octobre 2025 : La Cei outille les représentants des candidats","https://credochristi.com/a-la-une/presidentielle-doctobre-2025-la-cei-outille-les-representants-des-candidats/","fr","False","","16842","Credo Christi","https://credochristi.com/"
"50478658","2025-10-02 01:53:07","Ali Badarah Konaté à la tâche : « Le RHDP est en ordre de bataille pour offrir une victoire éclatante au Président Alassane Ouattara »","https://worldcanalinfo.com/ali-badarah-konate-a-la-tache-le-rhdp-est-en-ordre-de-bataille-pour-offrir-une-victoire-eclatante-au-president-alassane-ouattara/","fr","False","","16853","World Canal Info","https://worldcanalinfo.com/"
"50479597","2025-09-30 05:00:34","L’opposition ivoirienne et ses mirages électoraux","https://www.nordsud.info/lopposition-ivoirienne-et-ses-mirages-electoraux/","fr","False","","16481","NORD SUD","https://www.nordsud.info/"
"50479596","2025-09-30 15:14:42","Présidentielle 2025 : le RHDP prépare sa victoire","https://www.nordsud.info/presidentielle-2025-le-rhdp-prepare-sa-victoire/","fr","False","","16481","NORD SUD","https://www.nordsud.info/"
"50480588","2025-10-02 04:14:29","Adama Bictogo appelle les députés à être des « soldats de la paix »","http://www.jda.ci/news/politique-nationale-19437-adama-bictogo-appelle-les-dputstre-des-soldats-de-la-paix","fr","False","","14901","Toute l'info d'Abidjan","https://www.jda.ci/"
"50481266","2025-10-02 05:15:53","Côte d’Ivoire-AIP/ Présidentielle 2025: les producteurs de café-cacao donnent 20 millions FCFA pour la campagne d’Alassane Ouattara","https://www.aip.ci/257486/cote-divoire-aip-presidentielle-2025-les-producteurs-de-cafe-cacao-donnent-20-millions-fcfa-pour-la-campagne-dalassane-ouattara/?utm_source=rss&utm_medium=rss&utm_campaign=cote-divoire-aip-presidentielle-2025-les-producteurs-de-cafe-cacao-donnent-20-millions-fcfa-pour-la-campagne-dalassane-ouattara","fr","False","","14899","AIP (Agence Ivoirienne de Presse de Côte d'Ivoire)","https://www.aip.ci"
"50481385","2025-10-01 04:35:54","Côte d’Ivoire  : le peuple se lève…","https://ladepechedabidjan.info/2025/10/01/cote-divoire-le-peuple-se-leve/","fr","False","","10044","La Dépêche d'Abidjan","https://www.ladepechedabidjan.info/"
"50483717","2025-10-02 04:16:33","[Côte d’Ivoire – Présidentielle 2025] Vives tensions entre cadres du RHDP de Gbêkê lors d’une réunion à la Rue Lepic","http://lepointsur.com/cote-divoire-presidentielle-2025-vives-tensions-entre-cadres-du-rhdp-de-gbeke-lors-dune-reunion-a-la-rue-lepic/?utm_source=rss&utm_medium=rss&utm_campaign=cote-divoire-presidentielle-2025-vives-tensions-entre-cadres-du-rhdp-de-gbeke-lors-dune-reunion-a-la-rue-lepic","fr","False","","16604","Le Point Sur","http://lepointsur.com/"
"50483826","2025-10-02 07:03:36","Présidentielle 2025 : le tirage au sort de passage des candidats dans les médias de service public, effectué ce jeudi 02 octobre, donne dans l’ordre: Don Mello, Alassane Ouattara, Jean Louis Billon, Henriette Lagou et Simone Gbagbo","https://www.aip.ci/257620/presidentielle-2025-le-tirage-au-sort-de-passage-des-candidats-dans-les-medias-de-service-public-effectue-ce-jeudi-02-octobre-donne-dans-lordre-don-mello-alassane-ouattara-jean-louis-billon/?utm_source=rss&utm_medium=rss&utm_campaign=presidentielle-2025-le-tirage-au-sort-de-passage-des-candidats-dans-les-medias-de-service-public-effectue-ce-jeudi-02-octobre-donne-dans-lordre-don-mello-alassane-ouattara-jean-louis-billon","fr","False","","14899","AIP (Agence Ivoirienne de Presse de Côte d'Ivoire)","https://www.aip.ci"
"50484791","2025-10-02 07:18:03","Côte d’Ivoire-AIP/ Présidentielle 2025 : l’ordre de passage des candidats à la campagne médiatique connu","https://www.aip.ci/257621/cote-divoire-aip-presidentielle-2025-lordre-de-passage-des-candidats-a-la-campagne-mediatique-connu/?utm_source=rss&utm_medium=rss&utm_campaign=cote-divoire-aip-presidentielle-2025-lordre-de-passage-des-candidats-a-la-campagne-mediatique-connu","fr","False","","14899","AIP (Agence Ivoirienne de Presse de Côte d'Ivoire)","https://www.aip.ci"
"50484924","2025-10-02 04:21:13","Côte d’Ivoire : Augmentation record des prix de Kg du café et cacao / l’Assemblée nationale à rude épreuve","https://abidjantv.net/revue-de-presse/cote-divoire-augmentation-record-des-prix-de-kg-du-cafe-et-cacao-lassemblee-nationale-a-rude-epreuve/?utm_source=rss&utm_medium=rss&utm_campaign=cote-divoire-augmentation-record-des-prix-de-kg-du-cafe-et-cacao-lassemblee-nationale-a-rude-epreuve","fr","False","","10024","AbidjanTV.net","http://abidjantv.net/"
"50487050","2025-10-02 07:36:24","Côte d’Ivoire /Communiqué du Conseil des ministres du mercredi 1er octobre 2025","https://canalivoire.net/cote-divoire-communique-du-conseil-des-ministres-du-mercredi-1er-octobre-2025/","fr","False","","16841","Canal Ivoire","https://canalivoire.net/"
"50491804","2025-10-02 08:36:20","Présidentielle 2025 : Le G8 rejoint la machine électorale du RHDP","https://www.lemandatexpress.net/2025/10/02/presidentielle-2025-le-g8-rejoint-la-machine-electorale-du-rhdp/","fr","False","","16151","VidoRev - Video WordPress Theme","https://www.lemandatexpress.net/"
"50491802","2025-10-02 10:19:30","Présidentielle 2025 : la CEI instruit les cinq candidats sur le mode opératoire","https://www.lemandatexpress.net/2025/10/02/presidentielle-2025-la-cei-instruit-les-cinq-candidats-sur-le-mode-operatoire/","fr","False","","16151","VidoRev - Video WordPress Theme","https://www.lemandatexpress.net/"
"50496217","2025-10-02 12:22:55","Côte d’Ivoire-AIP/ Présidentielle 2025 : les représentants des candidats saluent l’égalité d’accès aux médias officiels après le tirage au sort de l’ANP","https://www.aip.ci/257738/cote-divoire-aip-presidentielle-2025-les-representants-des-candidats-saluent-legalite-dacces-aux-medias-officiels-apres-le-tirage-au-sort-de-lanp/?utm_source=rss&utm_medium=rss&utm_campaign=cote-divoire-aip-presidentielle-2025-les-representants-des-candidats-saluent-legalite-dacces-aux-medias-officiels-apres-le-tirage-au-sort-de-lanp","fr","False","","14899","AIP (Agence Ivoirienne de Presse de Côte d'Ivoire)","https://www.aip.ci"
"50496215","2025-10-02 12:30:55","Côte d’Ivoire-AIP/ La commission de la CEDEAO renforce les capacités des professionnels des médias sur la lutte contre la désinformation et la mésinformation","https://www.aip.ci/257725/cote-divoire-aip-la-commission-de-la-cedeao-renforce-les-capacites-des-professionnels-des-medias-sur-la-lutte-contre-la-desinformation-et-la-mesinformation/?utm_source=rss&utm_medium=rss&utm_campaign=cote-divoire-aip-la-commission-de-la-cedeao-renforce-les-capacites-des-professionnels-des-medias-sur-la-lutte-contre-la-desinformation-et-la-mesinformation","fr","False","","14899","AIP (Agence Ivoirienne de Presse de Côte d'Ivoire)","https://www.aip.ci"
